{
  "id": "0001",
  "title": "Resonant Honeycomb Infrastructure",
  "glyph": "◇⚙➝〰〰〰⬡ᘯᘰ⇑◧",
  "tags": ["matter", "engineering", "resonance", "bee-intelligence", "infrastructure"],
  "created_utc": "2025-08-23T00:00:00Z",
  "version": "v0.1",
  "protocol": {
    "mrp": {
      "seed": "◇⚙➝〰〰〰⬡",
      "intent": "Infrastructure design inspired by matter, engineering, resonance, and bee intelligence",
      "families_balanced": 17,
      "principles_balanced": 11,
      "flags": ["Turbulence","Reaction","Uncertainty"],
      "bridges": ["HEX↔FLOW","RES↔STRUCT"],
      "stabilizers": ["oxygenation lattice","fast feedback ring"],
      "spin_test": {
        "icosahedron": [0.85,0.78,0.81,0.76,0.72,0.88,0.79,0.74,0.77,0.8,0.69,0.83,0.82,0.71,0.75,0.7,0.84,0.73,0.8,0.78],
        "dodecahedron": [0.9,0.82,0.85,0.8,0.76,0.88,0.79,0.81,0.84,0.77,0.8,0.83]
      },
      "refined_glyph": "◇⚙➝〰〰〰⬡ᘯᘰ⇑◧"
    },
    "nip": {
      "conversions": {
        "Turbulence": "oxygenation/flow stability",
        "Reaction": "fast feedback loop",
        "Uncertainty": "silence as signal"
      }
    }
  },
  "insight": "A resonant honeycomb that metabolizes turbulence, uncertainty, and delay into resilience",
  "links": []
}
